{"Date Made Public": "2017-03-16", "date": "2017-03-16", "Company": "Select Restaurants Inc.", "City": "Cleveland", "State": "Ohio", "Type of breach": "HACK", "Type of organization": "BSO", "Total Records": 0, "Description of incident": "\"For the second time in the past nine months, Google has inadvertently  but nonetheless correctly helped to identify the source of a large  credit card breach \u2014 by assigning a \u201cThis site may be hacked\u201d warning  beneath the search results for the Web site of a victimized merchant. A little over a month ago, KrebsOnSecurity was contacted by multiple  financial institutions whose anti-fraud teams were trying to trace the  source of a great deal of fraud on cards that were all used at a handful  of high-end restaurants around the country. Two\u00a0of those fraud teams shared a list of restaurants that all  affected cardholders had visited recently.\u00a0A bit of searching online  showed that nearly all of those establishments were run by\u00a0Select Restaurants Inc.,  a Cleveland, Ohio company that owns a number of well-known  eateries\u00a0nationwide, including Boston\u2019s Top of the Hub; Parker\u2019s  Lighthouse in Long Beach, Calif.; the Rusty Scupper in Baltimore, Md.;  Parkers Blue Ash Tavern in Cincinnati, Ohio; Parkers\u2019 Restaurant &  Bar in Downers Grove, Illinois; Winberie\u2019s Restaurant & Bar with  locations in Oak Park, Illinois and Princeton and Summit, New Jersey;  and Black Powder Tavern in Valley Forge, PA.\"More Information: https://krebsonsecurity.com/2017/03/google-points-to-another-pos-vendor-...", "Information Source": "Krebs On Security", "Source URL": "", "Year of Breach": 2017, "Latitude": 41.49932, "Longitude": -81.694361}