{"Date Made Public": "2017-03-16", "date": "2017-03-16", "Company": "Denton Heart Group", "City": "Denton", "State": "Texas", "Type of breach": "PORT", "Type of organization": "MED", "Total Records": 0, "Description of incident": "\"On January 11, 2017, Denton Heart Group, a member of HealthTexas Provider Network, discovered an external computer hard drive containing patient information was stolen from its facility around December 29, 2016.The clinic immediately launched an investigation into the incident and found the information contained on the hard drive may have included patient information such as names, addresses, driver\u2019s license numbers, and Social Security numbers.Presently, the clinic has no evidence to suggest any information was misused in any way.\u201cWe regret any inconvenience caused by this incident,\u201d the healthcare organization stated in a posted announcement. \u201cNecessary corrective actions have been taken to safeguard against similar incidents in the future, and we are taking steps to re-evaluate the security of computer devices within our clinics to further protect our patient\u2019s information.\u201dThe statement did not list the number of patients affected by the incident.\"More Information: http://healthitsecurity.com/news/va-university-health-system-security-br...", "Information Source": "Media", "Source URL": "", "Year of Breach": 2017, "Latitude": 33.214841, "Longitude": -97.133068}