{"Date Made Public": "2014-12-01", "date": "2014-12-01", "Company": "Highlands-Cashier Hospital", "City": "Highlands", "State": "North Carolina", "Type of breach": "DISC", "Type of organization": "MED", "Total Records": 25000, "Description of incident": "Highlands-Cashier hospital in North Carolina informed patients of a data breach to their servers that contained patient data. The disclosure of the data was due to an error by one of their third party vendors, TruBridge a subsidiary of Computer Programs and Systems, Inc. when they were contracted to complete some specialized computer services.A data security screening caught the disclosure on September 29, 2014 that exposed patient information between May 2012 through September 2014. The information exposed included patient names, addresses, dates of birth, treatment information, diagnosis, helath insurance information and Social Security numbers. All of this information could be accessed via the Internet. For those who might have been affected you can call 1-888-227-14161-888-227-1416\u00a0 Monday through Friday between 9:00 a.m and 9:00 p.m Eastern Time. More Information: http://www.phiprivacy.net/highlands-cashiers-hospital-discovers-patient-...\u00a0CallSend SMSAdd to SkypeYou'll need Skype CreditFree via Skype", "Information Source": "PHIPrivacy.net", "Source URL": "", "Year of Breach": 2014, "Latitude": 35.085886, "Longitude": -83.187267}